<?xml version="1.0" encoding="UTF-8"?>
<!-- edited with XMLSpy v2011 (http://www.altova.com) by Laura Graham (Mohawk College) -->
<!--Sample XML file generated by XMLSpy v2011 (http://www.altova.com)-->
<CodeList xmlns:xsi="http://www.w3.org/2001/XMLSchema-instance" xsi:noNamespaceSchemaLocation="CodeTranslation.xsd">
	<Code codeSystem="1.2.3.4.5" displayName="some Drug Material Code DisplayName" codeSystemVersion="version 1" codeSystemName="Some CodeSystemName" code="12345">
		<Translations>
			<Code codeSystem="1.2.3.4.5.6" displayName="some Drug Translated Material Code DisplayName 6" codeSystemVersion="version 1" codeSystemName="Some Translated CodeSystemName 6" code="123456"/>
			<Code codeSystem="1.2.3.4.5.6.7" displayName="some Drug Translated Material Code DisplayName 7" codeSystemVersion="version 1" codeSystemName="Some Translated CodeSystemName 7" code="1234567"/>
            <Code codeSystem="2.16.840.1.113883.6.88" displayName="Dummy Translated RxNorm Drug" codeSystemVersion="version 1" codeSystemName="RxNorm" code="1111111"/>
		</Translations>
	</Code>
	<Code codeSystem="1.2.3.4.5" displayName="some Drug Material Code DisplayName" codeSystemVersion="version 1" codeSystemName="Some CodeSystemName" code="Some Drug Material Code 2">
		<Translations>
			<Code codeSystem="1.2.3.4.5.6" displayName="some Drug Translated Material Code DisplayName 6.2" codeSystemVersion="version 1" codeSystemName="Some Translated CodeSystemName 6" code="Some Transalted Drug Material Code 6.2"/>
			<Code codeSystem="1.2.3.4.5.6.7" displayName="some Drug Translated Material Code DisplayName 6.2" codeSystemVersion="version 1" codeSystemName="Some Translated CodeSystemName 7" code="Some Transalted Drug Material Code 6.2"/>
		</Translations>
	</Code>
</CodeList>
